{
  "schema_version": 1,
  "run_id": "20260513-152044-loopr-onboarding",
  "feature_name": "loopr-onboarding",
  "started_at": "2026-05-13T15:20:44Z",
  "last_checkpoint_at": "2026-05-13T16:47:02Z",
  "status": "faulted",
  "fault": {
    "type": "stuck_loop",
    "iteration": 9,
    "diagnostic": "Critic returned identical findings 5 iterations in a row (iter 5..9). PM /skip'd the recommended finding each time without addressing it. Identical output_hash: sha256:f7a2bd...",
    "detected_at": "2026-05-13T16:47:02Z"
  },
  "input_transcripts": [
    { "id": "T01", "hash": "sha256:a1f2c8...", "path": "transcripts/T01-onboarding-friction.vtt", "normalized_path": "transcripts/.normalized/T01-onboarding-friction.md" },
    { "id": "T02", "hash": "sha256:b3e91d...", "path": "transcripts/T02-workflow-speed.docx-paste.md", "normalized_path": "transcripts/.normalized/T02-workflow-speed.md" }
  ],
  "glossary_hash": null,
  "template_hash": "sha256:1e2f3a...",
  "themes": [
    { "id": "TH1", "name": "Onboarding friction in week one", "frequency": "2/2", "quotes": ["[T01:00:01:23]", "[T02]"] }
  ],
  "draft_sections": {
    "Background & Problem": { "last_refined_iteration": 1, "byte_delta": 540, "source_finding": "Finding 1: SOLUTION_BIAS (iter 1)" },
    "User Stories":         { "last_refined_iteration": 2, "byte_delta": 332, "source_finding": "Finding 2: PERSONA_STORY_MISMATCH (iter 2)" }
  },
  "qa_history": [
    { "iteration": 1, "kind": "critic_pass", "posed_at": "2026-05-13T15:26:01Z", "output_hash": "sha256:f1...", "findings": 4, "recommended_starting_point": "Finding 1" },
    { "iteration": 1, "kind": "discussion_turn", "posed_at": "2026-05-13T15:32:14Z", "answer_summary": "Refined Background to drop the 'dashboard widget' phrasing.", "finding_ref": "Finding 1" },
    { "iteration": 2, "kind": "critic_pass", "posed_at": "2026-05-13T15:41:09Z", "output_hash": "sha256:f2...", "findings": 3, "recommended_starting_point": "Finding 2" },
    { "iteration": 2, "kind": "discussion_turn", "posed_at": "2026-05-13T15:47:33Z", "answer_summary": "Mapped User Stories to the ops-lead persona.", "finding_ref": "Finding 2" },
    { "iteration": 3, "kind": "critic_pass", "posed_at": "2026-05-13T15:58:21Z", "output_hash": "sha256:f3...", "findings": 5, "recommended_starting_point": "Finding 1" },
    { "iteration": 4, "kind": "critic_pass", "posed_at": "2026-05-13T16:09:48Z", "output_hash": "sha256:f4...", "findings": 5, "recommended_starting_point": "Finding 1" },
    { "iteration": 5, "kind": "critic_pass", "posed_at": "2026-05-13T16:18:02Z", "output_hash": "sha256:f7a2bd...", "findings": 5, "recommended_starting_point": "Finding 1" },
    { "iteration": 5, "kind": "user_command", "posed_at": "2026-05-13T16:21:00Z", "command": "/skip", "note": "PM skipped Finding 1 (compliance scope)." },
    { "iteration": 6, "kind": "critic_pass", "posed_at": "2026-05-13T16:27:11Z", "output_hash": "sha256:f7a2bd...", "findings": 5, "recommended_starting_point": "Finding 1" },
    { "iteration": 6, "kind": "user_command", "posed_at": "2026-05-13T16:29:42Z", "command": "/skip", "note": "PM /skip again." },
    { "iteration": 7, "kind": "critic_pass", "posed_at": "2026-05-13T16:34:55Z", "output_hash": "sha256:f7a2bd...", "findings": 5, "recommended_starting_point": "Finding 1" },
    { "iteration": 7, "kind": "user_command", "posed_at": "2026-05-13T16:37:30Z", "command": "/skip" },
    { "iteration": 8, "kind": "critic_pass", "posed_at": "2026-05-13T16:42:19Z", "output_hash": "sha256:f7a2bd...", "findings": 5, "recommended_starting_point": "Finding 1" },
    { "iteration": 8, "kind": "user_command", "posed_at": "2026-05-13T16:44:55Z", "command": "/skip" },
    { "iteration": 9, "kind": "critic_pass", "posed_at": "2026-05-13T16:47:02Z", "output_hash": "sha256:f7a2bd...", "findings": 5, "recommended_starting_point": "Finding 1" }
  ],
  "iteration_count": 9,
  "qa_turn_count": 7,
  "cost_estimate_usd": 6.82
}
