{
  "schema_version": 1,
  "run_id": "20260515-143022-loopr-onboarding",
  "feature_name": "loopr-onboarding",
  "started_at": "2026-05-15T14:30:22Z",
  "last_checkpoint_at": "2026-05-15T15:47:11Z",
  "status": "in_progress",
  "fault": null,
  "input_transcripts": [
    { "id": "T01", "hash": "sha256:a1f2c8...", "path": "transcripts/T01-onboarding-friction.vtt", "normalized_path": "transcripts/.normalized/T01-onboarding-friction.md" },
    { "id": "T02", "hash": "sha256:b3e91d...", "path": "transcripts/T02-workflow-speed.docx-paste.md", "normalized_path": "transcripts/.normalized/T02-workflow-speed.md" },
    { "id": "T03", "hash": "sha256:c4d72e...", "path": "transcripts/T03-compliance-question.granola.md", "normalized_path": "transcripts/.normalized/T03-compliance-question.md" },
    { "id": "T04", "hash": "sha256:d5e83f...", "path": "transcripts/T04-contradictory-pricing.vtt", "normalized_path": "transcripts/.normalized/T04-contradictory-pricing.md" },
    { "id": "T05", "hash": "sha256:e6f94a...", "path": "transcripts/T05-handtyped-notes.md", "normalized_path": "transcripts/.normalized/T05-handtyped-notes.md" }
  ],
  "glossary_hash": "sha256:9a8b7c...",
  "template_hash": "sha256:1e2f3a...",
  "themes": [
    { "id": "TH1", "name": "Onboarding friction in week one", "frequency": "5/5", "quotes": ["[T01:00:01:23]", "[T02]", "[T03:00:00:45]", "[T04:00:02:11]", "[T05]"] },
    { "id": "TH2", "name": "Daily workflow speed", "frequency": "3/5", "quotes": ["[T01:00:03:40]", "[T02]", "[T04:00:01:08]"] },
    { "id": "TH3", "name": "Pricing acceptance — CONTRADICTION", "frequency": "2/5", "quotes": ["[T01:00:05:12]", "[T04:00:04:33]"] },
    { "id": "TH4", "name": "Compliance (SOC2/HIPAA)", "frequency": "1/5", "quotes": ["[T03:00:04:11]"] }
  ],
  "draft_sections": {
    "Goals & Non-Goals": { "last_refined_iteration": 3, "byte_delta": 412, "source_finding": "Finding 1: GOAL_METRIC_MISMATCH (iter 3)" },
    "Target Users":      { "last_refined_iteration": 4, "byte_delta": 287, "source_finding": "Finding 2: PERSONA_STORY_MISMATCH (iter 4)" },
    "Success Metrics":   { "last_refined_iteration": 5, "byte_delta": 612, "source_finding": "Finding 1: GOAL_METRIC_MISMATCH (iter 5)" }
  },
  "qa_history": [
    { "iteration": 1, "kind": "critic_pass", "posed_at": "2026-05-15T14:38:01Z", "output_hash": "sha256:c1...", "findings": 4, "recommended_starting_point": "Finding 1" },
    { "iteration": 1, "kind": "discussion_turn", "posed_at": "2026-05-15T14:42:15Z", "question": "What outcome would make this feature worth building even if SMB adoption is low?", "answer_summary": "SMB activation is THE outcome; enterprise is out of scope for v1.", "finding_ref": "Finding 1" },
    { "iteration": 2, "kind": "critic_pass", "posed_at": "2026-05-15T14:49:02Z", "output_hash": "sha256:c2...", "findings": 3, "recommended_starting_point": "Finding 2" },
    { "iteration": 2, "kind": "discussion_turn", "posed_at": "2026-05-15T14:53:30Z", "question": "Which persona's daily workflow is most disrupted today, and how would you know after launch?", "answer_summary": "Ops lead; signal is < 14-day activation rate moving from 38% to 60%.", "finding_ref": "Finding 2" },
    { "iteration": 3, "kind": "critic_pass", "posed_at": "2026-05-15T15:01:18Z", "output_hash": "sha256:c3...", "findings": 5, "recommended_starting_point": "Finding 1" },
    { "iteration": 3, "kind": "discussion_turn", "posed_at": "2026-05-15T15:06:44Z", "question": "What measurable signal corresponds to your 60% activation goal at the 14-day mark?", "answer_summary": "Count of teams whose 3 onboarding milestones are all done by day 14.", "finding_ref": "Finding 1" },
    { "iteration": 4, "kind": "critic_pass", "posed_at": "2026-05-15T15:18:09Z", "output_hash": "sha256:c4...", "findings": 4, "recommended_starting_point": "Finding 2" },
    { "iteration": 5, "kind": "critic_pass", "posed_at": "2026-05-15T15:34:11Z", "output_hash": "sha256:c5...", "findings": 3, "recommended_starting_point": "Finding 1" },
    { "iteration": 5, "kind": "discussion_turn", "posed_at": "2026-05-15T15:39:50Z", "question": "Under what conditions would your 60% activation target NOT be the right goal?", "answer_summary": "If we expand to enterprise the metric changes; for SMB-only v1 it's right.", "finding_ref": "Finding 1" }
  ],
  "iteration_count": 5,
  "qa_turn_count": 9,
  "cost_estimate_usd": 4.21
}
