{
  "schema_version": 1,
  "run_id": "test-run-001",
  "feature_name": "test-feature",
  "started_at": "2026-05-15T14:22:03Z",
  "last_checkpoint_at": "2026-05-15T14:22:03Z",
  "status": "in_progress",
  "fault": null,
  "input_transcripts": [
    { "id": "T01", "hash": "sha256:abc", "path": "transcripts/t1.vtt", "normalized_path": "transcripts/.normalized/t1.md" }
  ],
  "glossary_hash": null,
  "template_hash": "sha256:def",
  "themes": [],
  "draft_sections": {},
  "qa_history": [],
  "iteration_count": 0,
  "qa_turn_count": 0,
  "cost_estimate_usd": 0.0
}
