{
  "schema_version": 1,
  "run_id": "20260514-094812-loopr-onboarding",
  "feature_name": "loopr-onboarding",
  "started_at": "2026-05-14T09:48:12Z",
  "last_checkpoint_at": "2026-05-14T10:33:55Z",
  "status": "paused",
  "fault": null,
  "input_transcripts": [
    { "id": "T01", "hash": "sha256:a1f2c8...", "path": "transcripts/T01-onboarding-friction.vtt", "normalized_path": "transcripts/.normalized/T01-onboarding-friction.md" },
    { "id": "T02", "hash": "sha256:b3e91d...", "path": "transcripts/T02-workflow-speed.docx-paste.md", "normalized_path": "transcripts/.normalized/T02-workflow-speed.md" },
    { "id": "T03", "hash": "sha256:c4d72e...", "path": "transcripts/T03-compliance-question.granola.md", "normalized_path": "transcripts/.normalized/T03-compliance-question.md" }
  ],
  "glossary_hash": null,
  "template_hash": "sha256:1e2f3a...",
  "themes": [
    { "id": "TH1", "name": "Onboarding friction in week one", "frequency": "3/3", "quotes": ["[T01:00:01:23]", "[T02]", "[T03:00:00:45]"] },
    { "id": "TH2", "name": "Pricing — light evidence", "frequency": "1/3", "quotes": ["[T01:00:05:12]"] }
  ],
  "draft_sections": {
    "Goals & Non-Goals":  { "last_refined_iteration": 2, "byte_delta": 318, "source_finding": "Finding 1: GOAL_METRIC_MISMATCH (iter 2)" },
    "Target Users":       { "last_refined_iteration": 3, "byte_delta": 244, "source_finding": "Finding 1: PERSONA_STORY_MISMATCH (iter 3)" }
  },
  "qa_history": [
    { "iteration": 1, "kind": "critic_pass", "posed_at": "2026-05-14T09:54:00Z", "output_hash": "sha256:p1...", "findings": 4, "recommended_starting_point": "Finding 1" },
    { "iteration": 1, "kind": "discussion_turn", "posed_at": "2026-05-14T09:58:32Z", "question": "What's the leading indicator that the week-one friction is reducing?", "answer_summary": "Number of teams that complete the 3 setup milestones inside 7 days.", "finding_ref": "Finding 1" },
    { "iteration": 2, "kind": "critic_pass", "posed_at": "2026-05-14T10:08:42Z", "output_hash": "sha256:p2...", "findings": 3, "recommended_starting_point": "Finding 1" },
    { "iteration": 2, "kind": "discussion_turn", "posed_at": "2026-05-14T10:13:11Z", "question": "Why is week one the right window rather than week two?", "answer_summary": "Customer success data shows churn risk doubles after day 10 of inactivity.", "finding_ref": "Finding 1" },
    { "iteration": 3, "kind": "critic_pass", "posed_at": "2026-05-14T10:21:05Z", "output_hash": "sha256:p3...", "findings": 5, "recommended_starting_point": "Finding 2" },
    { "iteration": 3, "kind": "discussion_turn", "posed_at": "2026-05-14T10:27:18Z", "question": "Who specifically owns onboarding inside the SMB persona's org — the ops lead, the IT admin, or both?", "answer_summary": "Ops lead owns it; IT admin is consulted only for SSO setup.", "finding_ref": "Finding 2" },
    { "iteration": 3, "kind": "user_command", "posed_at": "2026-05-14T10:33:55Z", "command": "/pause", "note": "PM paused to wait for a customer call before continuing." }
  ],
  "iteration_count": 3,
  "qa_turn_count": 5,
  "cost_estimate_usd": 2.18
}
